<?xml version="1.0" encoding="ISO-8859-1"?>


<xsd:schema xmlns:xsd="http://www.w3.org/2001/XMLSchema"
                   elementFormDefault="qualified">

	<xsd:element name="creatures" type="Creatures"/>

	<xsd:element name="creature" type="Creature"/>


	<xsd:complexType name="Creatures">
		<xsd:sequence>
			<xsd:element name="creature" type="Creature" maxOccurs="unbounded"/>
		</xsd:sequence>
	</xsd:complexType>


	<xsd:complexType name="Creature">
		<xsd:sequence>
			<xsd:element name="type" type="Type" minOccurs="1"/>
			<xsd:element name="attributes" type="Attributes" minOccurs="1"/>
			<xsd:element name="level" type="Level" minOccurs="1"/>
			<xsd:element name="experience" type="Experience" minOccurs="1"/>
			<xsd:element name="drops" type="Drops" minOccurs="0"/>
			<xsd:element name="slots" type="Slots" minOccurs="0"/>
			<xsd:element name="equips" type="Equips" minOccurs="0"/>
			<xsd:element name="ai" type="Ai" minOccurs="1"/>
		</xsd:sequence>
		<xsd:attribute name="name" type="xsd:string"/>
	</xsd:complexType>

	<xsd:complexType name="Item">
		<xsd:attribute name="value" type="xsd:string"/>
		<xsd:attribute name="quantity" type="xsd:string"/>
		<xsd:attribute name="probability" type="xsd:nonNegativeInteger"/>
	</xsd:complexType>

	<xsd:complexType name="Drops">
		<xsd:sequence>
			<xsd:element name="item" type="Item" minOccurs="0" maxOccurs="unbounded"/>
		</xsd:sequence>
	</xsd:complexType>

	<xsd:complexType name="Attributes">
		<xsd:sequence>
			<xsd:element name="atk" minOccurs="1">
				<xsd:complexType>
					<xsd:attribute name="value" type="xsd:positiveInteger"/>
				</xsd:complexType>
			</xsd:element>
			<xsd:element name="def" minOccurs="1">
				<xsd:complexType>
					<xsd:attribute name="value" type="xsd:positiveInteger"/>
				</xsd:complexType>
			</xsd:element>
			<xsd:element name="hp" minOccurs="1">
				<xsd:complexType>
					<xsd:attribute name="value" type="xsd:positiveInteger"/>
				</xsd:complexType>
			</xsd:element>
			<xsd:element name="speed" minOccurs="1">
				<xsd:complexType>
					<xsd:attribute name="value" type="xsd:decimal"/>
				</xsd:complexType>
			</xsd:element>
			<xsd:element name="size" minOccurs="1">
				<xsd:complexType>
					<xsd:attribute name="value" type="xsd:string"/>
				</xsd:complexType>
			</xsd:element>
			<xsd:element name="noise" minOccurs="0">
				<xsd:complexType>
					<xsd:attribute name="value" type="xsd:string"/>
				</xsd:complexType>
			</xsd:element>
		</xsd:sequence>
	</xsd:complexType>

	<xsd:complexType name="Ai">
		<xsd:sequence>
			<xsd:element name="says" type="Says" minOccurs="0"/>
			<xsd:element name="profile" type="Profile" minOccurs="1" maxOccurs="unbounded"/>
		</xsd:sequence>
	</xsd:complexType>

	<xsd:complexType name="Says">
		<xsd:sequence>
			<xsd:element name="noise" type="Noise" minOccurs="0" maxOccurs="unbounded"/>
		</xsd:sequence>
	</xsd:complexType>

	<xsd:complexType name="Noise">
		<xsd:attribute name="value" type="xsd:string"/>
	</xsd:complexType>

	<xsd:complexType name="Profile">
		<xsd:attribute name="name" type="xsd:string"/>
		<xsd:attribute name="params" type="xsd:string"/>
	</xsd:complexType>

	<xsd:complexType name="Type">
		<xsd:attribute name="class" type="xsd:string"/>
		<xsd:attribute name="subclass" type="xsd:string"/>
		<xsd:attribute name="tileid" type="xsd:integer"/>
	</xsd:complexType>

	<xsd:complexType name="Level">
		<xsd:attribute name="value" type="xsd:integer"/>
	</xsd:complexType>

	<xsd:complexType name="Experience">
		<xsd:attribute name="value" type="xsd:integer"/>
	</xsd:complexType>

	<xsd:complexType name="Slots">
		<xsd:sequence>
			<xsd:element name="slot" type="xsd:string" minOccurs="0"/>
		</xsd:sequence>
	</xsd:complexType>

	<xsd:complexType name="Equips">
		<xsd:sequence>
			<xsd:element name="head" type="xsd:string" minOccurs="0"/>
			<xsd:element name="lhand" type="xsd:string" minOccurs="0"/>
			<xsd:element name="rhand" type="xsd:string" minOccurs="0"/>
			<xsd:element name="body" type="xsd:string" minOccurs="0"/>
			<xsd:element name="legs" type="xsd:string" minOccurs="0"/>
			<xsd:element name="feet" type="xsd:string" minOccurs="0"/>
		</xsd:sequence>
	</xsd:complexType>

</xsd:schema>